Type,PostCode,Borough,Area,Positioning,Date,Time,Description,Deaths
V1,SE23,Lewisham,Forest Hill,Perry Rise W side by Garnells Road,04/07/1944,23:19,FB Report 100-102 Perry Rise Severley Damaged 115-121 Perrry Vale Damaged Property within area bounded by Waldram park Road/Sunderland Road/Ayllward Road/Wynell Road/Mayow Road/Dacres Road/Perry Vale Slightly Damaged..,0
V1,SE23,Lewisham,Forest Hill,Honor Oak Road West Side nr Dunoon road Junction,05/07/1944,04:33,2 houses demolished and 6 severley damaged by blast in Honor Oak Road 36 houses slightly damaged in Hengrave Road,0
V1,SE23,Lewisham,Forest Hill,Perry Rise Wynell Alley Garnells Roads,08/07/1944,21:42,"Forest Hill lawn tennis club severely damaged 70-90 Perrry RIse,and shaws cottages wynell alley severley damaged Price of Wales PH Perry Rise,2-14 Garlies Road,11-17 Perry Vale,18,20,26 Perry Vale ,92-104 Perry Rise Damaged Property in area Mayow Road,Defrene road,Priestfield Road, Houston Road, Perry Vale, Woolstone Rd slighly damaged 30 injured",0
V1,SE23,Lewisham,Forest Hill,Dacres Road,10/07/1944,17:39,"28-42 ,9-13 Dacres road severe damage 44-48,2-7,12-26 Dacres Road,1-12 Bampton Road Damaged 51-65 and 68-72 Sydenham Park slight damage Property in area bounded by dacres rd,mayow rd,perry vale slight damaged Some houses damaged for 2nd time",0
V1,SE23,Lewisham,Forest Hill,Whitbread Road East end,18/07/1944,06:16,5 houses demolished 58 severe damaged 62 damage and 40 slight damage in Hurstbourne rd 36 severe damage 64 slight damage in Elsinire Road 4 houses severe damage in Vancouver Road Marler road previously damaged by blast and damaged again,3
V1,SE23,Lewisham,Forest Hill,Como Road South of Shipman Road junction,28/07/1944,00:05,"8 houses demolished and 40 severe damage in Como rd, 20 damaged 19 houses severe damage in Shipman st Propery in Shipman st,siddons rd,wollstone rd,perry vale,cranston rd,farren rd damaged.",4
V1,SE23,Lewisham,Forest Hill,Thorpwood Road Near Kirkdale junction,29/07/1944,19:40,"3 houses demolished 25 severe damage water main fractured, gas main fractured, property in thorpwood ave,reedlet av,kirkdale damaged.",3
V1,SE23,Lewisham,Forest Hill,Stanstead Road By Rockbourne Road,29/07/1944,18:24,"18 houses severe damage, 9 shops and flats and forest hill hotel severe damage,property in rockbourne rd,devonshire rd, beadnell rd,park rd damaged.",0
V1,SE23,Lewisham,Honor Oak,Stillness Road at Crofton Park Junction,31/07/1944,18:25,"1 houses demolished 16 severe damage 30 slight damage in Stilness Road 30 severe damage 30 slight damage (previous damage increased) in Crofton Park Road 18 houses damaged in Selhurst rd Property in Stilness rd,selhursrd sevenoaks rd damaged.",1
V1,SE23,Dulwich/Camberwell,Forest Hill,Lordship Lane Station,01/08/1944,09:49,Lordship Lane station and 3 houses demolished in Lordship Lane 20 houses damaged in Sydenham Hill,1
V1,SE23,Lewisham,Honor Oak,Honor Oak Park,01/08/1944,15:31,"Fly fell on open ground, surrounding property blast damaged,must either be the cemetry or one tree hill again. 3 injured 10 houses",0
V1,SE23,Lewisham,Forest Hill,Derby Hill,04/08/1944,18:18,"Fly on open ground 12 houses damaged by blast in Derby Hill LPTB tranformer station damaged. Property bounded by Taymount rise,Derby hill cres, and Dartmouth Road slight damage no casualties",0
V1,SE23,Lewisham,Honor Oak,Ackroyd Road/Brockley Rise,16/08/1944,18:45,"church severe damage in ackroyd rd,9 houses demolished 5 severe damage in brockley rise,2 houses demolished 1 severe damage in Duncombe Hill. Property bounded by Brockley rise,gabriel st,bovel road and agnew rd damaged.",3
V1,SE23,Lewisham,Honor Oak,Courtrai Road/Bartram Road.Buckthorn Road,16/08/1944,18:24,"10 houses demolished 5 severe damage in Buckthorne 2 houses demolished 4 severe damage in Courtrai rd 1 house demolished 1 severe damage in Bartram rd Property bounded by Buckthorne,grierson,kilgour and Eddystone rd damaged",2
V2,SE23,Lewisham,Forest Hill,Holmseley Road/Kilgour Road,15/11/1944,12:50,31-39 & 32-34 destroyed.,12
V2,SE23,Lewisham,Forest Hill,Boveney Road at junction with Devonshire Road,19/12/1944,23:26,Hit in a similar location to earlier V1 increasing degree of damage,0
V1,SE24,Dulwich/Camberwell,Dulwich,Junction Turney Road and Burbage Road North East side,22/06/1944,04:43,"The First V1 to fall in SE24 at the junction of Burbage Road and Turney Road . 4 houses were demolished (In Burbage Road ). 10 were severely damaged and 83 slightly damaged in Burbage Road ,111 in Turney Road The houses in Burbage Road have been re-built in the original style. Their vintage is however betrayed by their 1940's metal windows. The neighbouring properties have been repaired.",4
V1,SE24,Dulwich/Camberwell,Herne Hill,Carver Road,10/07/1944,21:00,"The V1 fell on the South side of Carver Road , about half way up. 6 houses were demolished and 50 badly damaged. The houses have been re-built in a similar style although a close inspection will reveal differences which illustrate their history.",1
V1,SE24,Lambeth,Herne Hill,Guernsey Grove/South Croxted Road,27/07/1944,01:22,The V1 fell in Guernsey Grove on the North West side of the Croxted Road junction. 6 houses were demolished and 20 badly damaged in Guernsey Grove. 3 rail arches damaged and 10 houses damaged in Rosendale Road The impact area can clearly be seen as the site has been re-developed as a post war style housing estate,0
V1,SE24,Dulwich/Camberwell,Herne Hill,Stradella Road South West Side,11/08/1944,07:29,The V1 struck in Stradella Road on the West Side . . 6 houses were demolished and 30 damaged. 20 houses damaged in South Croxted Road as well as railway arches. The V site today has been in-filled with 60's flats.,1
V1,SE24,Lambeth,Brixton,Half Way up West side Shakespeare Road (North Side),23/08/1944,20:56,The V1 fell about half way up Shakespeare Road on the West side. 4 houses were demolished and 40 damaged.,0
V1,SE25,Croydon,South Norwood,Junction Warminster Road and Avenue Road,15/06/1944,05:07,V1 struck Warminster Road the first to fall in the Borough of Croydon 5 houses were demolished and 30 severely damaged.,1
V1,SE25,Croydon,Selhurst,St James Road and Selhurst new road,17/06/1944,02:40,V1 in Selhurst New Road demolished 7 houses and caused severe blast damage to surroundings,7
V1,SE25,Croydon,Upper Norwood,North West side of Ross Road,21/06/1944,14:52,"V1 in Ross Road . There is a very detailed Croydon Borough Engineers report for the incident which reports ""Demolished 36,38,40,22,44 Ross Road and 45 Falkland Park Avenue 32,34,46,48 Ross Road and 37,39,41,43,47,49,51,53 Falkland Park Avenue unstable 24-30 & 50-58 19,21,33,35 Ross Road and 25-35 55 57 59 42-50 Falkland Park Avenue seriously damaged. Blast damage across 1/4 mile radius"" It is of interest that the Blast damage in Ross Road and Falkland Park Avenue is undetectable as the Houses were rebuilt in the same style as their Neighbours",2
V1,SE25,Croydon,South Norwood,On railway by Tennison Road Bridge,23/06/1944,06:45,V1 in Tennison Road Damage in Merton Road to a lean to timber shed building and premises uses as a store main bldn severe damaged 4 trucks laden with coal damaged by fire and blast,0
V1,SE25,Croydon,Upper Norwood,West side South Norwood Hill between Whitehorse lane and Ross Road,28/06/1944,23:02,V1 on South Norwood Hill. 8 houses demolished and large area of severe blast damage. Small fire under debris,5
V1,SE25,Croydon,South Norwood,Denmark Road,29/06/1944,06:53,"V1 struck Denmark Road , demolishing 5 houses and causing severe damage to 20 more",6
V1,SE25,Croydon,Upper Norwood,Ross Road opposite Grange Park,01/07/1944,07:29,Further V1 in Ross Road causing sever damage to 6 houses and slight damage to 15,0
V1,SE25,Croydon,South Norwood,Junction of Lancaster Road and Warminster Road,02/07/1944,05:47,The 2nd of 4 V1's to hit the South Norwood Park area. It demolished 6 houses and caused severe damage to 30 more,2
V1,SE25,Croydon,South Norwood,Portland Road near Pembury Road,04/07/1944,21:58,V1 in Portland Road . It demolished 4 houses and caused severe damage to 30 more,0
V1,SE25,Croydon,South Norwood,Estcourt Road,05/07/1944,19:08,V1 in Estcourt Road which demolished 6 houses and 40 more were severely damaged,5
V1,SE25,Croydon,South Norwood,Dickensons Lane Woodside,07/07/1944,21:09,"V1 in Dickensons Lane the Fire Brigade reported that ""10x12 yards of grass burned. Surrounding property damaged by blast. Hit brickworks. """,0
V1,SE25,Croydon,South Norwood,Between Woodvale Avenue Lancaster Road Court Road,08/07/1944,21:44,V1 in Woodvale Avenue . It demolished 4 houses and caused severe damage to 40 more,6
V1,SE25,Croydon,South Norwood,Corner Harrington road and Albert Road,09/07/1944,21:47,V1 in Harrington Road . It demolished 10 houses and caused severe damage to surrounding property.,7
V1,SE25,Croydon,South Norwood,Dagnall Park,14/07/1944,08:53,V1 in Dagnall Park . 14 houses demoloshed and 40 severely damaged.,0
V1,SE25,Croydon,Upper Norwood,South East Side Ross Road,19/07/1944,13:28,The 3rd V1 to Fall in Ross Road . This one demolished a further 8 houses,0
V1,SE25,Croydon,South Norwood,Estcourt Road South Norwood,22/07/1944,03:09,The 2nd V1 to Fall in Estcourt Road demolishing 3 houses,0
V1,SE25,Croydon,South Norwood,Junction Warminster and Avenue Road,11/08/1944,07:42,The 4th of 4 V1's to fall in the South Norwood Park Incident. This one hit Warminster Road demolishing 10 houses.,1
V2,SE25,Croydon,South Norwood,Sunnybanks,20/10/1944,20:15,"This was the sole V2 in the area a direct hit on 9-10 Regina Road Sunnybanks. IT has been reported that ""Exploded under the foundations with such as force that the houses simply disappeared leaving behind only a water filled crater 23 feet in diameter and 14 feet deep""",6
V1,SE27,Lambeth,West Norwood,Tivoli Road Crown Hill junction,18/06/1944,04:38,This was the first V1 to fall on SE27 West Norwood. It fell on the boundary of Lambeth and Croydon and was to cause damage in both SE27 and SE19 Although it is recorded in the former as it fell on that side of the road. 2 houses were demolished and 30 suffered severe damage. The area was re-developed post war so It is not possible to see where the damage area was,0
V1,SE27,Lambeth,West Norwood,Junction Gypsy Road/Bentons Road,03/07/1944,21:37,This Doodlebug landed at the junction of Gypsy road and Bentons road (now Bentons lane ) and was the first of 2 to fall very close to each other. It demolished 10 houses and caused severe damage to 40 others. 6 people died in the attack. The area was extensively damaged by these two bombs and the resulting post was development area can clearly be seen,6
V1,SE27,Lambeth,West Norwood,Norwood Road Junction with York Hill,04/07/1944,13:15,"This was the first of 3 Doodlebugs that were to decimate the York Hill area of West Norwood . It landed behind the shops in the Norwood Road in the North West Quadrant of the junction with York Hill It totally demolished 6 houses and severely damaged 20 others in York Hill. In the Norwood Road 30 shops were badly damaged as were 10 houses in Ullswater Road . Re-built shops can be seen in the Norwood Road . The whole of the North Side of York Hill, before the Harpenden Road junction has been re-built",11
V1,SE27,Lambeth,West Norwood,Junction Norwood Road & Robson Road,05/07/1944,01:19,This V1 fell on shops/houses in the Norwood road at the entrance to West Norwood Cemetery . 3 shops/houses were totally demolished and 30 suffered severe damage. The whole of this corner was demolished and is now occupied by the (new) west Norwood Library.,0
V1,SE27,Lambeth,West Norwood,West Norwood Cemetery,17/07/1944,05:12,This V1 fell in West Norwood Cemetery and destroyed the crematorium chapel and caused severe damage to surrounding buildings,0
V1,SE27,Lambeth,West Norwood,Knights Hill junction with Furneaux Road,21/07/1944,10:18,This V1 struck at the junction of Knights Hill and Furneaux Road . 4 houses were demolished and 20 suffered severe damage in Knights Hill. 2 were demolished and 20 badly damaged in Furneaux Road .,1
V1,SE27,Lambeth,West Norwood,Clive Road/Hamilton Road junction,22/07/1944,07:37,This V1 fell at the junction of Clive and Hamilton Road 's . 4 houses were totally demolished and 20 badly damaged. The area has been totally re-developed with post-war housing,3
V1,SE27,Lambeth,West Norwood,Norwood Park,22/07/1944,21:08,This V1 landed somewhere in Norwood Park although the exact location is not recorded. It caused damage to Lambeth Home for the aged and also to 20 houses. No casualties were listed,0
V1,SE27,Lambeth,West Norwood,York Hill South East of railway,27/07/1944,19:35,This was the 2nd of 3 V1's that were to cause major damage in the York Hill area. It fell on the South side of York Hill between the railway and the Norwood Road.5 people died in the attack. 6 houses were totally demolished and 12 suffered severe damage in York Hill. The severe damage area extended to Harpenden Road where 4 houses were demolished and 20 damaged. Both sides of York Hill have been extensively re-developed because of the bombing in this area. The re-built houses in Harpenden road can also clearly be seen,5
V1,SE27,Lambeth,Tulse Hill,Norwood Road by Tulse Hill rail bridge,29/07/1944,21:42,"This V1 fell in the Norwood road by the railway bridge that carries the line from Tulse Hill to Streatham. The railway bridge was very badly damaged and the signal box demolished. 20 hops and 30 houses suffered severe damage in the immediate area. 6 people died in the attack. The re-built shops in the Norwood Road , to the North of the railway bridge can clearly be seen.",6
V1,SE27,Lambeth,West Norwood,Junction Gypsy Road /Auckland Hill,03/08/1944,05:04,This was the 2nd of the V1's that were to fall in the Gypsy Road area of West Norwood not far from the previous one on the 3rd July. This one struck the area around the junction of Gypsy Road and Auckland Hill where is crosses over the railway. Re-built post war housing can be seen here.,3
V1,SE27,Lambeth,West Norwood,Knights hill Square bottom of St Julians Farm Road,13/08/1944,01:30,This V1 struck Knights Hill Square which pre-war was an area of small terrace housing. It demolished 4 houses in the Square and caused severe damaged to 6 shops and 10 houses in Knights Hill. 20 houses also suffered major damage in Ernest Avenue . The area today has been re-developed with light industrial units and no trace of the terrace housing remains.,8
V1,SE27,Lambeth,West Norwood,YorkHill/Knollys Road /Cambrian Close,22/08/1944,07:29,The 3rd and last of the V1's that were to badly damage the York hill area. This one struck further up York Hill on the North side between Knollys Road and Cambrian Close. It demolished 6 houses and caused severe damaged to 20 others in Knollys Road . 10 houses suffered major damage in York Hill and Cambrian Close. It was the last V1 to fall in SE27,2
V2,SE27,Lambeth,West Norwood,Chatsworth Way,18/09/1944,19:02,"This was the only V2 that fell in SE27, it was further west than the majority reached. It was also the last missile to be fire by the Germans before operations were interrupted by the Allied invasion at Arnhem ,Operation Market Garden. One witness described"" a sphere of flame hurtling earthwards like a football on fire which was followed by a bright flash and a frightful roar"". From this description it sounds as if this may have been an air burst V2 . It was a direct hit on the Church which stood at the junction do Chatsworth Way and Idmiston Road . The church was partly demolished and about 40 houses demolished or very badly damaged. The church was re-built in the 60's as were houses in the surrounding area so the blast area can clearly be seen",2
V1,SE4,Lewisham,Brockley,Brockley Road near end of Whitbread Road East end,16/06/1944,02:30,This was the first of 5 V1's that were to fall in a small area of Brockley causing extensive damage. . Much re-development around the Whitbread Road/Brockley Road Junction is apparent.- its also caused major damage to the Mortuary chapel in Brockley cemetry,0
V1,SE4,Lewisham,Brockley,Dalrymple Road/Brockley Road junction,19/06/1944,22:06,"The second of 5 V1's to fall in a concentrated area of Brockley. Numbers 2-34 Dalrymple Road and 5-15 Beechcroft Road suffered severe damage. There was extensive damage to surrounding property in Whitbread Road,Howson Road,Comerford Road,Merritt Road,Brockley Road,Hazledon Road,Holdenby Road. Extensive post-war re-development is apparent at this point.",1
V1,SE4,Lewisham,Brockley,Ewhurst Road (Crofton Park Road/Sevenoaks Road junction),23/06/1944,02:15,"Extensive damage to properties in Ewhurst Road, Crofton Park Road,Salehurst Road,Stilness Road,Manwood Road,Glynde Road,Bexhill Road,Brightling Road,Sevenoaks Road,Otford Crescent,Horsmondon Road",3
V1,SE4,Deptford,Brockley,Endwell Road Railway bridge/Brockley Cross,24/06/1944,07:23,"6 shops were severely damaged. All property in the boundaries of Geoffrey Road,Upper brockley Road,Vulcan Road,Vest Road,Sprules Road,Drakefell Road and Mantle Road slightly damaged",2
V1,SE4,Lewisham,Brockley,Junction Avignon and Aspinall Road,29/06/1944,22:27,"It is recorded that 1-39 and 10-40 Avignon Road were demolished,2-8 severely damaged. Property in area bounded by St Asaphs Road,Ivydale Road,Finland Road,Revelon Road damaged.",3
V1,SE4,Lewisham,Brockley,Braxfield Road/Commerford Road,03/07/1944,08:40,"The 3rd of 5 V1's that were to fall in an already devastated part of Brockley. .59-73 and 6-76 Braxfield Road Severely damaged 43-57,4--58 Braxfield damaged 1a-41,2-40 Braxfield Road/35-325 Brockely Road/280-308 Brockley Road/30-32 Dalrymple Road/1-33 Howson Road/Slightly Damaged. 26-80 Hoswon Road Damaged.",5
V1,SE4,Lewisham,Brockley,Frensbury Road junction with St Norberts Road,06/07/1944,03:50,Nine blocks of flats severely damaged and surrounding property in the boundaries of Brockley Way Turnham Road St Noberts Road slightly damaged .,0
V1,SE4,Lewisham,Brockley,Junction Breakspeare Road/Harefield Road NE quadrant,06/07/1944,14:34,"It is reported that ""1-77 & 79 Breakspere Road Severely damage 88-130/81-91/60-86/61-79/93-147 Breakspeare Road Damaged 29-59/42-58 Breakspeare Road slight damaged St Peter Church Hall 87-97Cranfield Road slight damaged 37-63/63-82 Wickham Road slightly damaged 40-110 25-79 Tressillian Road Slightly damaged 2-16-1-13 Tressillian Crescent Slightly damaged 1-11 /2-16 Drake Road Slightly damaged",8
V1,SE4,Lewisham,Brockley,Turnham Road,11/07/1944,13:07,"This V1 struck in Turnham Road close to one 5 days earlier and causing further damage to the same blocks of flats. No deaths are recorded. The area of blast extended to Brockley Way, Turnham Road and St Norberts Road",0
V1,SE4,Lewisham,Brockley,North side Hilly fields by Crescent,15/07/1944,15:48,"""The Homestead"" Hilly fields cres severe damage 8 houses in Hilly fields cres severe damage 5 houses in Hillyfields cres damaged 112 houses in Cliffview rd,Trywhitt rd, Tressillan cres, Crescent way, Montague ave slight damage. The post war rebuilding houses is Hillyfields Crescent can clearly be seen",0
V1,SE4,Lewisham,Brockley,Whitbread Road East end,18/07/1944,04:56,The 4th of 5 V1's to strike the already badly Whitebread Road area of Brockley. .7 houses demolished and 40 severe damage 40 houses damaged in Whitbread rd 6 demolished and 20 severe damage 20 damaged in Comerford 2 severe damage in Brockely Road Catholic church and school damaged in Howson rd. The area shows extensive signs of post war re-development,0
V1,SE4,Deptford,Brockley,Whitbread Road Road,19/07/1944,08:40,"The 5th of 5 V1's that fell on this shattered part of Brockley. It struck at a similar point to the one the previous day. There was further damage to Whitbread Road,Comerford Road,Brockley Road,Howson Road,Dalrympe Road.",0
V1,SE4,Lewisham,Brockley,Arica Road Halfway down,27/07/1944,21:35,"A 3 inch water main and sewer were badly damaged. Property in St Norberts Road,Brockley Crescens and St asaphs Road were slightly damaged.Property In Arica Road Badly damaged",0
V1,SE4,Deptford,Brockley,Half way along Cranfield Road by Railway,27/07/1944,17:56,"2 houses demolished and 20 severe damage in Cranfield Road 10 houses severe damage in GeoffreyRoad Property in Cranfield Road Geofrey Road Brockley Cross Manor rd,Wickham rd damaged",0
V1,SE4,Lewisham,Brockley,Guys Hospital Athletic Groundf,27/07/1944,15:25,"A pavilion and grand stand were damaged. Properties bounded by Stilness Road, Crofton Park\Road,Stendon Road,SevenoaksRoad were damaged.",0
V1,SE4,Lewisham,Brockley,LBSCR Railway by Brockley Way (was footpath then),02/08/1944,08:34,"Railway embankment demolished and 1 x 4 floor block of flats and one surface shelter damaged. Surrounding property in Turnham rd,Brockley Way, St Norberts Rd ,slight damage",0
V1,SE4,Deptford,Brockley,North End Endwell Road,16/08/1944,18:32,".6 houses demolished 45 damaged rail embankment damaged surrounding property in Vesta rd,sprules rd,millmark grove,brockley cross slight damage",9
V2,SE4,Lewisham,Brockley,Adelaide Avenue corner of Eastern Road,17/09/1944,18:56,This was the first of 5 V2 rockets that struck SE4 causing grave loss of life. 14 people were killed and 29 seriously injured. 5 members of the same family died in the same house. The blast area can clearly be seen today indicated by the footprint of post-war re-development at this point.,14
V2,SE4,Lewisham,Brockley,Between Finland and Revelon Road,02/02/1945,08:22,"This extremely serious incident happened when the V2 rocket fell in the gardens between Finland Road and Revelon Road. 20 houses were demolished and 30 suffered severe damage.The dead in this attack included 5 members of the same family. The damage extended to an area bounded by Revelon Road, Accacia Road,Mantle Road, Avignon Road. The area of the blast damage is clearly seen as the line of housing in Finland and Revelon Roads isinterrupted by a post war school site",34
V2,SE4,Lewisham,Brockley,Marnock Road Brockley Grove Junction,11/02/1945,22:00,"Demolished 26 houses….14 dead 69 injured….train lost all its windows as it was travelling through Crofton park station. Area bounded by Darfield rd,Brockley rd,Brockley grove,Brockley Hall rd,Bearsted rise,Horsmonden rd,Sevenoaks rd,Crofton park rd…slight damage. Extensive post war re-building can be seen around this point.",14
V2,SE4,Deptford,Brockley,Wickham Road by S side Wickham Gardens,11/03/1945,20:04,"8 houses demolished and 70 severely damaged in Wickham Road,and Brockley Road.4 houses demolished 20 severe damaged in Wickham gardens 100 houses slight damage in Breakspear and Harefield rds 60 houses slight damage in Cranfield Road 3 shops and 4 houses slight damage in Caulgate st 6 shops 80 houses slight damage in Foxberry Road 40 houses slight damage in Harecort rd 6 shops and 100 houses slight damage in Brockley rd. The are bounded by Wickham Gardens,Brockley Road and Wickham Road has been completely re-developed as a housing estate. The effect of the V2 is starkly illustrated in Wickham gardens where the original Victorian houses remain on the North Side but on the damaged south side they have been totally replaced by 1960's flats.",9
V2,SE4,Lewisham,Brockley,Crofton Park Station,23/03/1945,02:20,This V2 airburst over Crofton Park station. Debris was scattered widely and a fire was caused at the station by either an alcohol or peroxide tank. pArt of the station roof was damaged.,0
V1,SE5,Dulwich/Camberwell,Camberwell,Around junction with Walworth Road,,,This V1 is clearly shown on the bomb damage maps but I have been unable to find a corresponding Fire Brigade or ARP record.,0
V1,SE5,Dulwich/Camberwell,Camberwell,Medlar st by Railway,17/06/1944,03:21,Numbers 1-21 Medlar Street Suffered severe damage. The Railway bridge was badly damaged and collapsed.,0
V1,SE5,Dulwich/Camberwell,Camberwell,Crawford Road/Lowth Road,23/06/1944,17:22,12 houses were demolished and 20 badly damaged.,0
V1,SE5,Dulwich/Camberwell,Camberwell,Hillingdon st between Farmers and Warham Road,25/06/1944,04:05,"50houses,4 shops and a pub were destroyed. 100 houses and an area of 500 yards square consisting of 5 streets severely damaged. For a graphic description of this attack see the recollections of Barbara Mcnally.",23
V1,SE5,Dulwich/Camberwell,Camberwell,Wyndham road /Elfin Road,26/06/1944,01:30,18 houses were demolished and 60 badly damaged.,3
V1,SE5,Dulwich/Camberwell,Camberwell,Corner Peckham Road./St Giles Road NW Quadrant,28/06/1944,17:34,"A serious incident that occurred when a V1 hit a block of flats, Bentley House, on the corner of Peckham Road and St Giles Road. The flats were partly demolished. St Giles hospitaly was also damaged. Bentlley house has been re-built but the differing brick work of the pre and post war portions can clearly be seen",19
V1,SE5,Dulwich/Camberwell,Camberwell,Camberwell Station Road,03/07/1944,03:02,A gas main was fractured and 30 houses badly damaged.,5
V1,SE5,Dulwich/Camberwell,Camberwell,Jardine Street and Scarsdale rd,08/07/1944,23:21,The area today is totally transformed as it forms part of Burges Park,1
V1,SE5,Dulwich/Camberwell,Walworth,Between Albany road and Neate St,29/07/1944,14:32,A shop was demolished and surrounding property badly damaged. Today the area is totally transformed as it has been cleared and forms part of Burges Park,3
V1,SE5,Dulwich/Camberwell,Camberwell,Camberwell Grove right over LBSCR Railway West Side,29/07/1944,00:15,12 houses were demolished and 30 damaged.,2
V1,SE5,Dulwich/Camberwell,Camberwell,Jardin Street & Coburg Road,03/08/1944,03:40,4 Houses demolished in Jardin st.Propert over and area of 100 yards sqaure damaged by blast.The area today is transformed as it forms part of Burgess Park,3
