Type,PostCode,Borough,Area,Positioning,Date,Time,Description,Deaths
V1,SE11,Lambeth,Lambeth,St Thomases Hospital N end,15/07/1944,15:25,The V1 struck B Block of St Thomases Hospital causing severe blast damage . The was also a fire. 40 houses were damaged in Lambeth Palace Road . The Hospital was re-built post war with typical 1960's blocks at this end of the complex.,0
V1,SE11,Lambeth,Kennington,Kennington lane Tate St around the junction with Vauxhall street,18/07/1944,16:34,The 2nd of the V1's that were to fall in very close proximity to each other. This one badly damaged 30 houses.,3
V1,SE11,Lambeth,Lambeth,Lambeth Road by Lambeth High St S Side,21/07/1944,08:14,The V1 struck between 115 and 127 Lambeth Road . It caused major damage to the Eldorado Ice Cream company building and substantial blast damage to other buildings in the vicinity.,1
V1,SE11,Lambeth,Lambeth,Lambeth Reach,21/07/1944,12:15,"This V1 is recorded as having fallen on Lambeth Reach which was either in the Thames or on the Bank. There was blast damage to the Petroleum board, Lambeth Council , Hovis and the NFS.",0
V1,SE11,Southwark,Elephant,Holyoake Road Dante Road junction,29/07/1944,14:26,"This V1 was the 2nd of 2 in very close proximity. It demolished 20 houses and caused blast damage to 200 others. 2 surface air raid shelters were partly demolished and partially demolished a circular steel dam of 22,000 gallons (NFS?)",5
V1,SE11,Lambeth,Kennington,Kennington Park Road Stannary st junction,16/08/1944,16:52,This serious V1 incident occurred when the Flying bomb demolished 10 houses and shops and caused major damage to a rag warehouse. Property in an area of 100yards square damaged.,10
V1,SE11,Lambeth,Kennington,Kennington park Road at Kennington Oval,24/08/1944,18:38,Serious Incident when the V1 struck a tram depot. 4 tramcars and a bus badly damaged. Alverstone House (flats) suffered major blast damage.,10
V2,SE11,Lambeth,Lambeth,Morton Place (cant find on map but at Lambeth North,04/01/1945,20:29,"This tragic V2 rocket incident happened when the missile struck a Surrey Lodge dwellings (a block of flats) . It also partially demolished Lambeth public baths, partly demolished the Ideal Cinema, the Mission hall, the l Wesleyan school and Institute .Site today totally re-developed much of it with 60's tower blocks.",42
V1,SE12,Lambeth,Hither Green,11 Micheldelver Road,16/06/1944,00:00,No further information available,1
V1,SE12,Lewisham,Lee,Lampmead/Lenham Road,22/06/1944,04:48,No further information available,5
V1,SE12,Lewisham,Grove Park,Somertrees Avenue Halfway down,24/06/1944,01:15,3 houses demolished in Somertrees/24 damaged in Somertrees/17 damage in Lemay Avenue/5 damaged in Luffnam Road/62 damaged in Marvels Lane/6 damaged in Balders rise/13 damaged in Marvels Close.,1
V1,SE12,Lewisham,Lee,Winn Road and Exford Road,03/07/1944,01:13,2 demolished in Winn road 3 severely damage in Winn Road/19 damaged in Winn Road/38 Slightly damaged in Winn Road/3 severely damage in Exford Road/3 damaged in Exford Road/15 slightly damaged in Exford Road/29 slightly damage in Ashdale Road/4 injured.,0
V1,SE12,Lewisham,Hither Green,Linchmere Road Baring Road junction,09/07/1944,02:34,2 demolished in Linchmere Road,0
V1,SE12,Lewisham,Lee,Weigall Road,21/07/1944,05:36,"5-36 sheds of 1 floor 240x 60 feet used as workshops and offices demolished ,medium fire. one raf lorry severe damage 33,34,37 and 38 Sheds severe damage 2 raf lorries severe damage air ministry sheds and bldns damaged.",0
V1,SE12,Lewisham,Grove Park,Hither Green Sidings To North East,29/07/1944,00:00,No further details available,4
V1,SE12,Lewisham,Hither Green,Harland Road baring Road junction,31/07/1944,15:00,"Property in baring road damage, property in Reigate rd damaged.",0
V1,SE12,Lewisham,Hither Green,Newstead Road N side halfway down,05/08/1944,04:40,2 houses demolished 22 severe damage property bounded by birch grove and dallinger road damage,0
V1,SE12,Lewisham,Lee,Harland Road Baring Road,16/08/1944,08:50,"3 shops and flts and 10 houses severe damage in Baring rd property bounded by Harland,baring including Summerfield tavern, Baptist church st Mildreds hall damaged",3
V2,SE12,Lewisham,Grove Park,Jevington Way,15/12/1944,00:00,No further details available,0
V1,SE14,Deptford,Brockley,Drakefell Road North Side around number 75,23/06/1944,06:51,"This was the first V1 to fall in the SE14 area. It badly damaged 20 houses and caused further damage to property in Kitto Road , Pepys Road , Avignon Road, Aspinal Road and St Asaphs Road . The impact site has been re-developed with some very interestingly designed houses.",0
V1,SE14,Deptford,New Cross,To West of St Donats Road in Goldsmiths grounds,26/06/1944,15:17,"This V1 fell in the grounds of Goldsmiths College to the West of St Donatts Road. . Severe damage was caused to 3 houses. Further damage caused to property bounded by Lewisham Way , New Cross Road , St James Road , Barriedale Road and Shardloes Road .",0
V1,SE14,Deptford,New Cross,Coldblow Lane,27/06/1944,02:40,This Flying Bomb exploded in Coldblow Lane near the railway. 100 yards of railway track and embankment were badly damaged. A signal box and railway cottage also damaged as was surrounding property in Coldblow Lane and Archangle Wharf,0
V1,SE14,Deptford,New Cross,Coldblow Lane,02/07/1944,02:22,The further V1 in Coldblow Lane caused severe damage to 80 yards of railway track and further damage to surrounding property. It left a large crater and damaged 20 railway wagons.,0
V1,SE14,Deptford,New Cross,Between Queens Road and Besson St,03/07/1944,03:48,"The V1 struck between Queens Road and Besson Street . .3 houses were demolished. 32 houses in Queens Road , Kender Street and Besson Street were badly damaged.",1
V1,SE14,Deptford,Telegraph Hill,Drakefell Road around number 36,04/07/1944,23:57,"34-40 Drakefell Road were totally demolished. Damage to properties in an area bounded by Bousfield Road , Arbuthnot Road , Waller Road , Kitto Road , Avignon Road, St Asaphs Road . Site has been re-developed with 1960's local authority housing",4
V1,SE14,Deptford,New Cross,Coldblow lane,07/07/1944,14:35,This is the third V1 to be recorded as having struck Coldblow Lane . The Flying Bomb fell on railway property but caused damaged in Brocklehurst Street and Hunsdon road,0
V1,SE14,Deptford,Telegraph Hill,Erlanger Road north End,12/07/1944,08:51,"7 houses were badly damaged in Erlanger Road and surrounding property in Queens Road , Pepys Road , Arbuthnot Road and Rural place suffered some damage",0
V1,SE14,Deptford,Deptford,Arklow Road East Side,12/07/1944,16:50,40 yards of railway track were damaged. houses were demolished. A railway shed and the remainder of houses in Arklow and Kerry road were damaged.,0
V1,SE14,Deptford,New Cross,Ommaney Road/Jernigham Road W of Junction,20/07/1944,06:40,"4 houses were demolished in Ommaney Road . Property in area bounded by Jerningham Road , Pepys Road and New Cross Road suffered some damage.",1
V1,SE14,Deptford,New Cross,New Cross gate station,21/07/1944,04:50,"This V1 struck in Railway property behind Goodwood Road . 50 feet of railway track and 2 trucks suffered severe damage as did 2 empty passenger trains. Surrounding property bounded by Brocklehurst Street , New Cross Road and Goodwood Road suffered some damage.",0
V1,SE14,Deptford,New Cross,Between New Cross Road and Achillies St,01/08/1944,14:16,"A 4 floor rug factory and 5 houses were demolished. There was a small fire in the debris. All properties in Achillies Street , New Cross Road , Pagnell Street , Clifton Rise suffered severe damage. Properties in Walpole Road and Lewisham Road suffered slight damage.",8
V1,SE14,Deptford,New Cross,Troutbeck Road Halfway down,02/08/1944,06:31,4 houses were demolished. There was severe damage to 30 houses and a tram depot. Property in the area bounded by Musgrove Road and New Cross Road suffered slight damage.,4
V1,SE14,Deptford,Brockley,Millmark Grove,06/08/1944,04:09,".It demolished 16 houses and fractured a gas main. A further 80 houses suffered severe damage. Property in area bounded by Shardloes Road , Vesta Road , Endwell Road ,Brockley Cross were slightly damaged.",2
V1,SE14,Deptford,Deptford,At Milton court Road and Vansittart st junction,28/10/1944,00:00,This V1 is shown on the bomb damage maps as striking around the junction of Milton Court Road and Vansittart Street . No record can be found in the Fire Brigade logs so no further information can be provided. The amount of re-development in this area would tend to confirm a Flying Bomb strike. It may be that the V1 fell in the 1st September 1944-31stDecember 1944 period which the Fire Brigade Records are missing for. Its existence is however confirmed by a casualty record at this address on the Commonwealth War Graves web site,1
V2,SE14,Deptford,New Cross,Railway Grove Angus Street,28/10/1944,11:11,This V2 airburst over Woolwich leaving bits of debris falling onto Blackheath and then crashed to earth near New Cross Station. . Survivors and dead removed from the ruins of more than 40 houses. Visiting the area today it is totally transformed. The streets of Victorian terrace housing have totally disappeared at this point to be replaced by a recreation ground.,7
V2,SE14,Lewisham,Brockley,Corner of Shardloes and St Donatts Road,01/11/1944,18:32,This serious incident occurred when a V2 Rocket struck the corner of Shardloes and St Donatts Road .. A dozen terraced houses were destroyed and the tram track was torn up. The area today has been re-developed as a housing estate.,36
v2,SE14,Deptford,New Cross,New Cross High Street,25/11/1944,12:26,This horrific incident was the worst of the entire V weapon attacks. 168 people were killed when a V2 rocket struck the Woolworth's store in New Cross High street . The casualty total has been taken from the Woolworth's memorial web site. The whole block of buildings has been re-built and is now occupied by an Iceland and carries a memorial plaque.,168
V2,SE14,Deptford,Telegraph Hill,Kitto Road around 66.,06/01/1945,13:43,10 houses and a church were demolished and a further 20 houses suffered severe damage. Property in Gallatly Road Arbuthnot Road Pepys Road and Drakefell Road suffered slight damage.,1
V2,SE14,Deptford,New Cross,Trundle Road,07/03/1945,03:20,"This very serious incident happened when a V2 Rocket fell between two blocks of flats called Folkestone Gardens in Trundle Road . Both blocks of flats were destroyed as were 5 houses. There were 2 small fires. All property in area Sanford st, Knoyle st,rolt st slight damage. 10 shops and houses in trundleys rd severe damage. 8 railway arches used as spinning mills slight damage .The Folkestone Gardens flats belonged to the Southern Railway most if not all of the casualties were railway employees or their dependents. The site today is a small park.",53
V1,SE15,Dulwich/Camberwell,Nunhead,Gibbon road senate street junction,15/06/1944,23:45,The V1 is clearly shown on the bomb damage maps but there is no corresponding fire brigade report. The date was confirmed from Dulwich and Camberwell ARP records. The extent of the damage is not known although the impact site is clearly defined from the extensive re-development at this point.,4
V1,SE15,Dulwich/Camberwell,Peckham,Reddens Road/Unwin Road,18/06/1944,08:30,It is noted that primary impact point was the South Metropolitan gas company.,4
V1,SE15,Dulwich/Camberwell,Peckham,Nunhead Lane/Peckham Rye junction SE quadrant,22/06/1944,08:50,"This serious incident occurred when the V1 struck at around 105 Peckham rye. 105 was demolished and 107-119 suffered severe damage. All buildings in area bounded by Peckham rye, Solomans passage, Arden road, Nunhead lane, Old James St , Whorlton road slight damage + small fire in debris. One of the buildings that was destroyed was a corset manufactures and many of the victims seem to have been young female workers.",23
V1,SE15,Dulwich/Camberwell,Nunhead,Between Hollydale Road and Stanbury Road,23/06/1944,02:12,"50 private houses damaged in Hollydale Road , surrounding property in St Mary's,Stanly and Lugard Roads slightly damaged by blast.",3
V1,SE15,Dulwich/Camberwell,Nunhead,Between Banstead Road and Nunhead Grove,26/06/1944,16:00,"4 houses damaged in Banstead Road . Property in the boundaries of Linden Grove, Evelina Road and Nunhead Lane slightly damaged",2
V1,SE15,Dulwich/Camberwell,Peckham,Willow Brook Road/Summit Road junction,27/06/1944,10:56,1 houses was demolished and there was 1 fire. Property over a 200 yards Square area badly damaged.,3
V1,SE15,Dulwich/Camberwell,Peckham,Green Hundred Road/Camelot Road,27/06/1944,12:04,"Number 55-69 and 42-62 Green Hundred Road were very badly damaged and all property in the area bounded by Old Kent Road , Peckham Park Road , Friary Road and Commercial way suffered some damage.",9
V1,SE15,Dulwich/Camberwell,Nunhead,Peckham Rye by Rye hill Park,27/06/1944,20:11,56 and 58 severely damaged. Remainder of Rye Hill Park and Peckham Rye slightly damaged.,1
V1,SE15,Dulwich/Camberwell,Peckham,Penance Road Willow Brook Road/Summit Road junction,28/06/1944,22:38,"The V1 struck close to the previous one in Willow Brook road the day before, increasing the degree of damage. A 3 inch gas main was damaged.",1
V1,SE15,Dulwich/Camberwell,Nunhead,Kimberley Avenue junction with Evelina Road N quadrant,30/06/1944,09:32,"The V1 demolished 67,69,71,79,81,83.85. severely damaged. Surrounding property in Evelina Road ,Grim wade Crescent, kirkwood road, Hollydale road slightly damage, slight damage to railway track. Persons rescued from Anderson shelters at 73-77 Kimberley Avenue",5
V1,SE15,Dulwich/Camberwell,Peckham,Between Stuart Road And Reynolds Road,01/07/1944,18:27,"This serious incident occurred when the V1 struck between Stuart and Reynolds Road . 16-36 Stuart Road and 9-17 Reynolds Road were demolished, There was a small fire. A further 50 houses were damaged by blast.",17
V1,SE15,Bermondsey,Bermondsey,Hatch am Street Ilderton Road /Record St NW Quadrant,02/07/1944,10:51,"It is recorded that a 2 storey building was demolished and that property bounded by Ilderton Road , Tustin Street, Penarth Street and Very road were damaged. The area had previously been badly hit by conventional bombing. This V1 fell on the border of Bermondsey and Dulwich /Camberwell. Although conformation exists by cross checking bomb maps and fire brigade reports no ARP record exists for either area. The dead are confirmed in the Bermondsey war dead book",8
V1,SE15,Dulwich/Camberwell,Peckham,Radnor Road,02/07/1944,11:14,10 houses were demolished and 40 badly damaged.,5
V1,SE15,Dulwich/Camberwell,Peckham,Costa Street,02/07/1944,11:50,3 houses were demolished and 30 badly damaged in Costa Street . 4 demolished and 30 badly damaged in Wag horn Street.,6
V1,SE15,Dulwich/Camberwell,Peckham,Peckham Park Road,03/07/1944,03:46,The V1 hit Peckham and Radnor Road very close to the incident the day before. 140-150 Peckham Park road were demolished and 30 houses damaged.,0
V1,SE15,Dulwich/Camberwell,Peckham,Between Clayton and Cicely Road,07/07/1944,23:59,6 houses were demolished and 80 badly damaged.,5
V1,SE15,Dulwich/Camberwell,Peckham,Copeland Road on LBSCR railway Bridge,12/07/1944,19:14,"6 houses demolished and 30 badly damaged. The bomb fell close to the down line at the Junction and destroyed the track and lifted the bridge above, demolished the whole of the central trestle except for one stanchion, left the bridge in a precarious state of suspense.",0
V1,SE15,Dulwich/Camberwell,Peckham,Commercial way appx junction with Pentridge st,16/07/1944,11:10,6 houses demolished and 30 damaged.,2
V1,SE15,Dulwich/Camberwell,Peckham,Between Wood Road between 1-25 Harpers Road Mews,19/07/1944,12:03,13 houses were demolished.,6
V1,SE15,Dulwich/Camberwell,Peckham,Mckerell Road,19/07/1944,14:34,A building of 2 floors used as cattle food manufactures demolished.6 shops and houses demolished 50 damaged by blast small fire.,11
V1,SE15,Dulwich/Camberwell,Peckham,North end Frensham Street,22/07/1944,02:56,The V1 badly damaged a range of buildings 300 x 30 feet and 30 houses.,0
V1,SE15,Dulwich/Camberwell,Peckham,Bird in Bush Road Friary Street junction,22/07/1944,10:25,10 houses were demolished and 50 badly damaged.,1
V1,SE15,Dulwich/Camberwell,Peckham,Southampton Way West Side South of Dalwood Street junction,27/07/1944,19:32,6 houses and a garaged demolished.20 houses badly damaged. A building of 2 floor about 100 x 30 feet used as a food storage warehouse partly demolished and fire damaged.,0
V1,SE15,Dulwich/Camberwell,Peckham,SE end Kinsale Road,29/07/1944,14:24,The V1 demolished 4 houses and seriously damaged 4 others.,4
V1,SE15,Dulwich/Camberwell,Nunhead,Ivydale road/Inverton Road junction,12/08/1944,01:30,"10 houses demolished church and 20 houses damaged small fire in Ivydale 7 shops and houses church hall and 6 houses damaged in Inverton 20 houses damaged in Bellwood 20 houses damaged in Surrey rd Today the signs of the Flying bomb can still be seen. The church has recently been re-built , and number of sites still are occupied by pre-fabs.",2
V1,SE15,Dulwich/Camberwell,Peckham,Scilla Road Claude Road junction NW quadrant,13/08/1944,02:10,6 houses were demolished and 30 damaged.,2
V1,SE15,Dulwich/Camberwell,Peckham,LBSCR Railway by Bidwell St,15/08/1944,15:39,"There was severe damage to 120 feet of rail track and the bridge. 10 houses were demolished and 50 badly damaged. Property in area Queens Road , Lugard Road ,harders road slight damaged. There was also a small fire.",0
V1,SE15,Dulwich/Camberwell,Nunhead,Ivydale road/Opposite Cemetery West Side North of Limesford Road,17/08/1944,06:44,Sports pavilion destroyed 30 houses demolished 60 houses severe damage and surrounding property in the boundaries of Ivydale Limesford Linden grove slight damage .,3
V1,SE15,Dulwich/Camberwell,Nunhead,Athenlay Road/FernHolm Road Junction,15/10/1944,01:50,"This V1 occurred after the main attacks were over. : A report states : FLY coming in from the East,(which may have indicated and air launch or conventional launch from the Netherlands .) It impacted on a row of 2 storey terrace houses of poor construction with 9 inch walls, wood floors and slate roof erected about 60 years ago, at the Southern junction of Ferholme and Athenlay roads, causing demolition to 3 houses, damage beyond repair to 19 houses ,serious damaged to 60 houses. Damage calling for first aid repair to about 500 others within a radius of about 300 yards from the point of impact. Anderson shelters to rear of Fernholme Road badly damaged. There were 8 trapped casualties that had to be rescued This site today remains mainly undeveloped apart from one modern houses and some pre-fabs. Due to this fact the damage area is clearer to see than at most other V1 sites.",8
V2,SE15,Dulwich/Camberwell,Peckham,Hardcastle Street (was between Hill St and Marmont Road ),19/11/1944,07:05,This V2 hit Hardcastle Street in the centre of Peckham which was between Hill Street and Marmont Road .,9
V2,SE15,Dulwich/Camberwell,Camberwell,Azenby Road near railway,06/01/1945,22:40,"Severe damage to railway workshops. 15 Railway carriages badly damaged. A toilet paper factory and 150 houses damaged in Azenby Road , Lyndhurst Road, Chadwick Grove and Talgourd Road .",0
V2,SE15,Dulwich/Camberwell,Peckham,Waite St at Trafalgar Avenue junction,14/02/1945,10:00,"This very serious Rocket Attack occurred when the V2 struck Waite Street and the junction of Trafalgar Avenue Following details obtained from Camberwell ARP records : A LRR penetrated a 3 storey houses at the SW angle of Trafalgar Av with Waite Street, forming a crater at ground level about 40 feet across by 10 foot deep. Blast caused the complete demolishing of 12 4 storey 'neo Greek' type of terrace houses of poor construction erected about 90 years previously. Damage beyond repair to about 25 similar properties adjoining the crater and damage calling for first aid repairs to properties within a s radius of about 200 yards of the crater. Rescue operations were concerned with the release of 10 trapped casualties which were found by dogs. Initial casualties were 13 killed,28 seriously injured to Kings Guys St Olavï¿½s and Dulwich. 60 slight injuries to first aid post or nearby hospitals. Search proceeding for 10 missing or trapped persons In another report : all CD service made a prompt attendance but far too many vehicles were permitted to drive right up to the scene of the incident. The results was that in the narrow streets conditions for a time bordered on the chaotic and at least one occasion a loaded ambulance was unable to get away to hospital until other vehicles had reversed out of the way. The principal trouble was caused by a mobile 1st aid unit belonging to Camberwell council. Further congestion was caused through the apparent inability (or disinclination) of the police to clear the affected areas of sightseers. There were plenty of police but at the time of arrival only one road was roped off. Even though this was done civilians were allowed to pass the barrier without hindrance. The writer personally spoke to the police and suggested the sightseers should be cleared but the Inspector said he could do this until the parking situation had been attended to. For a time all police efforts were concentrated on removing a blast damaged lorry. Even when the writer left the site at 11.12 there were still may civilians looking on and no roads had been closed to the public. Had written note on bottom of report adds that this information should be treated as confidential .",18
V1,SE16,Bermondsey,Bermondsey,LBSCR By Surrey Canal,,,This V1 on the LBCSR railway by the Surrey Canal is shown on both the bomb damage maps and the local paper maps published after the war. I cannot find a corresponding ARP or Fire Brigade record.,0
V1,SE16,Bermondsey,Rotherhithe,Redriff Road Opposite Canada Dock,,,This V1 in the Redriff Road is shown on the Bomb damage maps but I cannot reconcile it with an incident on the ARP records or Fire Brigade records,0
V1,SE16,Bermondsey,Rotherhithe,Silwood Street by Railway,,,This V1 in Silwood street is clearly shown on the bomb damage maps but I cannot reconcile it with either the ARP records or Fire Brigade records. As such I can provide no further information. To that extent there may be some doubt as to the accuracy of the bomb damage maps.,0
V1,SE16,Bermondsey,Bermondsey,Raymouth Road,16/06/1944,00:17,This V1 struck Raymouth Road,7
V1,SE16,Bermondsey,Deptford,Between Croft St and Chilton Grove,18/06/1944,01:15,This very serious incident occurred when the V1 struck between Crofton Street and Chilton Street . .8 houses were totally demolished and 200 suffered serious blast damage. The area today has been totally re-developed with local authority housing,18
V1,SE16,Bermondsey,Rotherhithe,Between Russia and Lady Dock,18/06/1944,05:00,This V1 struck Chamberlains wharf between Russia and Lady Dock. There were no casualties but a great deal of damage was caused to both the wharf and it foodstuff contents,0
V1,SE16,Bermondsey,Rotherhithe,,19/06/1944,17:15,"This V1 is not shown on the bomb maps and there is no Fire Brigade record. However, it is shown in both the Bermondsey ARP records and book of war dead. It struck Upper Crane Wharf in the Rotherhithe Street area and caused damaged to Rotherhithe Street , St Marys Church Street and Brunel Road .",1
V1,SE16,Bermondsey,Rotherhithe,Greenland Dock,23/06/1944,04:13,This V1 struck the SS Tristam which was standing in Greenland Dock at the time. The V1 hit the portside decking and penetrated though to the engine room. The same ship was struck again by a V1 on the 12st July.,2
V1,SE16,Bermondsey,Rotherhithe,Moodkee Street Lower Road junction,23/06/1944,04:13,"This was the first of 5 V weapons that were to fall in a very small area of Rotherhithe. This incident was followed by 2 further V1 and2 V2's.. 23 houses demolished This area today it is clear that no pre-war buildings remain demonstrating the sheer extent of the damage around this area,",6
V1,SE16,Bermondsey,Rotherhithe,South Wharf . Canï¿½t find it on old Rotherhithe Map. probably by South Dock,28/06/1944,03:25,The V1 struck South Wharf in Rotherhithe Street and damaged a range of buildings including some LCC flats.,0
V1,SE16,Bermondsey,Rotherhithe,Nelson Dock,30/06/1944,07:55,The V1 plunged into the Thames Adjacent to Nelson Dock. Damage was caused to the wharves and adjacent property. No casualties are reported,0
V1,SE16,Bermondsey,Rotherhithe,Lawrence Wharf,30/06/1944,16:40,The V1 plunged into the river adjacent to Lawrence Wharf . Slight blast damage was caused to the wharf .,0
V1,SE16,Bermondsey,Rotherhithe,Trinity Wharf,05/07/1944,20:04,The V1 struck Trinity Wharf . 1 person was killed and 3 injured. The Motor tug Jean was severely damaged and 5 barges slightly damaged. There was further damage to surrounding property,1
V1,SE16,Bermondsey,Rotherhithe,Albion Dock NE Side,09/07/1944,14:06,"This V1 descended on Albion Dock and exploded on impact with baulks of floating timber in the dock. A 1 storey brick building was severely damaged. An invasion barge, barge sections,4 temporary wooden structures and surrounding property damaged.",0
V1,SE16,Bermondsey,Rotherhithe,Centre Yard ( was to North East of Albion Dock),11/07/1944,11:26,6 people were injured when the V1 hit Centre yard which was to the North East of Albion dock,0
V1,SE16,Bermondsey,Rotherhithe,Russia Rock NE corner,11/07/1944,17:45,The V1 exploded on floating timber in Russia dock. 2 people were injured,0
V1,SE16,Bermondsey,Rotherhithe,Greenland Dock,12/07/1944,15:24,"This was the second V1 to hit the SS Tristam which was moored in Greenland Dock, by Brunswick yard. There was severe damage to 3 and 4 holds. The nearby SS Peebles was also damaged.",6
